{"type":"config","name":"Optimizing relancers RLNC throughput","metricName":"encode_time_ms","metricUnit":"ms","bestDirection":"lower"}
{"run":1,"commit":"cf93178","metric":2.897,"metrics":{"decode_time_ms":20.419,"recode_time_ms":1.169},"status":"keep","description":"Baseline: relancers RLNC encode/decode/recode","timestamp":1777825637967,"segment":0,"confidence":null,"iterationTokens":287,"asi":{"hypothesis":"Baseline measurement before any optimizations","encode_thrpt_mibs":355.99,"decode_thrpt_mibs":24.499,"recode_thrpt_mibs":454.91,"bottleneck":"Per-byte field element conversions in encode_symbol and symbol scale/add operations"}}
{"run":2,"commit":"b73037c","metric":2.73,"metrics":{"decode_time_ms":20.419,"recode_time_ms":1.169},"status":"keep","description":"Loop interchange in encode_symbol: iterate symbols outer, bytes inner","timestamp":1777826462221,"segment":0,"confidence":null,"iterationTokens":11845,"asi":{"hypothesis":"Reorganizing encode_symbol to process each symbol sequentially (scaled + XOR) instead of strided byte-by-byte accumulation improves cache locality","next_action_hint":"Try removing zero-byte/branch guards in scale_byte; explore packed field operations for bulk processing","bottleneck":"Per-byte field conversions remain dominant despite better memory access pattern"}}
{"run":3,"commit":"b485b24","metric":2.6506,"metrics":{"decode_time_ms":20.419,"recode_time_ms":1.169},"status":"keep","description":"Remove zero-byte early-exit guard in Symbol::scale","timestamp":1777826926489,"segment":0,"confidence":3.103274559193949,"iterationTokens":11845,"asi":{"hypothesis":"On random data, the branch misprediction cost of `if byte == 0` exceeds the savings from skipping multiplication","next_action_hint":"Explore packed field bulk operations (PackedAESBinaryField16x8b) for 16x throughput","bottleneck":"Per-byte field conversions still dominate"}}
{"run":4,"commit":"86a075c","metric":0.213,"metrics":{"decode_time_ms":20.419,"recode_time_ms":1.169},"status":"keep","description":"Add precomputed AES GF(2^8) multiplication table + fast path in Symbol::scale","timestamp":1777829114680,"segment":0,"confidence":21.78571428571425,"iterationTokens":11845,"asi":{"hypothesis":"Precomputed 256x256 multiplication table turns field multiply into a single cache lookup, bypassing binius scalar packed-field overhead","bottleneck":"encode_symbol still clones each symbol before scaling; need in-place scale_add_assign","next_action_hint":"Add in-place scale_add_assign to avoid per-symbol clone; apply table to decoder/recode paths"}}
{"run":5,"commit":"95fa22f","metric":0.141,"metrics":{"decode_time_ms":1.3406,"recode_time_ms":0.0722},"status":"keep","description":"Loop unroll scale_add_assign_aes by 8x; remove redundant init_matrix in decode; lazy partial symbols","timestamp":1777831138218,"segment":0,"confidence":11.185064935064936,"iterationTokens":11845}
{"run":6,"commit":"268c1f1","metric":0.0345,"metrics":{"decode_time_ms":0.4218,"recode_time_ms":0.0186},"status":"keep","description":"SSSE3 split-table SIMD for AES GF(2^8) mul using _mm_shuffle_epi8","timestamp":1777832027876,"segment":0,"confidence":2.2112784859018926,"iterationTokens":11845}
{"run":7,"commit":"ee19b8b","metric":0.0185,"metrics":{"decode_time_ms":0.2836,"recode_time_ms":0.011},"status":"keep","description":"AVX2 split-table SIMD (256-bit _mm256_shuffle_epi8) for AES GF(2^8)","timestamp":1777832363365,"segment":0,"confidence":14.799485861182518,"iterationTokens":11845}
{"run":8,"commit":"824033a","metric":0.0174,"metrics":{"decode_time_ms":0.264,"recode_time_ms":0.00904},"status":"keep","description":"AVX-512VBMI split-table SIMD (512-bit _mm512_shuffle_epi8) for AES GF(2^8)","timestamp":1777832743173,"segment":0,"confidence":18.104998428167242,"iterationTokens":11845}
{"run":9,"commit":"b3a6bc1","metric":0.0169,"metrics":{"decode_time_ms":0.2365,"recode_time_ms":0.0089},"status":"keep","description":"Fast-path coefficient generation for AES (fill_bytes instead of F::random); raw-byte matrix ops in decoder (neutral)","timestamp":1777837617922,"segment":0,"confidence":23.301779935275082,"iterationTokens":11845,"asi":{"hypothesis":"Speed up coefficient generation for AESTowerField8b by using fill_bytes instead of per-element F::random. Also try raw-byte coefficient matrix in decoder to avoid transmute_copy overhead.","decoder_raw_byte_result":"Neutral to slightly worse (0.234ms -> 0.236ms), likely because transmute_copy on u8 is already free and the raw pointer cast adds aliasing concerns","rng_fast_path_result":"Encode improved from 0.0188ms to 0.0169ms (~10% win) by using ChaCha8Rng::fill_bytes for AES coefficients"}}
{"run":10,"commit":"b3a6bc1","metric":0.0172,"metrics":{"decode_time_ms":0.2374,"recode_time_ms":0.0094},"status":"discard","description":"#[inline(always)] on SIMD wrappers + scale_add_assign_aes (no improvement)","timestamp":1777839105212,"segment":0,"confidence":40.73691654879773,"iterationTokens":11845,"asi":{"hypothesis":"Force inlining of SIMD wrappers and scale_add_assign_aes to eliminate function call overhead in decode hot loop","result":"No improvement - compiler was already inlining the hot paths; function symbols in nm are dead code kept for COMDAT","next_action_hint":"Decode overhead is not in function call overhead but in L1 cache capacity (64KB working set > 48KB L1d) and lack of GFNI. Focus on algorithmic changes or in-place symbol processing"}}
{"run":11,"commit":"af5b873","metric":0.018,"metrics":{"decode_time_ms":0.2303,"recode_time_ms":0.0091},"status":"keep","description":"Avoid push+clone in gaussian_elimination symbol selection; use ptr::write into pre-allocated Vec","timestamp":1777839540190,"segment":0,"confidence":163.64204545454538,"iterationTokens":11845}
{"run":12,"commit":"f5de4dd","metric":0.183,"metrics":{"decode_time_ms":0.183,"recode_time_ms":0.00908},"status":"keep","description":"Avoid 512KB copy in decode() by transmuting Vec<Symbol<M>> into Vec<u8> via from_raw_parts; also fix generic path to use separate Vec<F> matrix","timestamp":1777840297734,"segment":0,"confidence":40.73691654879773,"iterationTokens":11845,"asi":{"decode_improvement":"~20% vs 230µs baseline","hypothesis":"The final copy from Vec<Symbol<M>> to Vec<u8> in decode() was copying 512KB unnecessarily. By using Vec::from_raw_parts to transmute the Vec<Symbol<M>> into Vec<u8> (safe because Symbol<M> is #[repr(transparent)] over [u8; M] and Copy), we avoid this copy entirely. Also separated the generic path matrix to Vec<F> to fix compilation.","note":"All 125 tests pass. Decode now ~183µs (2.67 GiB/s), getting closer to rlnc's ~171µs (5.7 GiB/s)."}}
{"run":13,"commit":"f5de4dd","metric":0.1829,"metrics":{"decode_time_ms":0.1829,"recode_time_ms":0.00908},"status":"discard","description":"Remove split_at_mut in decoder Gauss-Jordan by using raw pointers","timestamp":1777840386032,"segment":0,"confidence":23.415447154471543,"iterationTokens":11845,"asi":{"hypothesis":"split_at_mut in the inner loop of Gauss-Jordan was adding overhead","next_action_hint":"Focus on more impactful optimizations","result":"No measurable change (~182.9µs vs ~182.9µs); LLVM already optimizes split_at_mut away"}}
{"run":14,"commit":"665054b","metric":0.0183,"metrics":{"decode_time_ms":0.1827,"recode_time_ms":0.0093},"status":"keep","description":"Add optimized profile with LTO/codegen-units=1 for users who want maximum performance; no code changes","timestamp":1777843866174,"segment":0,"confidence":40.73691654879773,"iterationTokens":125370,"asi":{"hypothesis":"Adding an optimized profile with LTO and codegen-units=1 allows users to get better performance (decode improves ~10% to ~164µs) without affecting default release builds.","note":"This is a Cargo.toml-only change. Release profile numbers remain encode ~18.3µs, decode ~182.7µs, recode ~9.3µs. The optimized profile improves decode to ~164µs."}}
{"run":15,"commit":"eee95c0","metric":0.0179,"metrics":{"decode_time_ms":0.182,"recode_time_ms":0.0104},"status":"keep","description":"Final benchmark after exhaustive optimization; reached practical limit without GFNI","timestamp":1777845075751,"segment":0,"confidence":163.64204545454538,"iterationTokens":53311,"asi":{"baseline_encode_ms":2.9,"baseline_decode_ms":20.42,"baseline_recode_ms":1.169,"encode_speedup":"162x","decode_speedup":"112x","recode_speedup":"112x","final_encode_us":17.9,"final_decode_us":182,"final_recode_us":10.4,"rlnc_encode_us":10.9,"rlnc_decode_us":171,"rlnc_recode_us":5.1,"remaining_gap_encode":"1.6x","remaining_gap_decode":"1.07x","remaining_gap_recode":"2.0x","bottleneck":"Lack of GFNI for AESTowerField8b (different irreducible polynomial than standard AES). Binius has GFNI paths but requires compile-time target-feature=+gfni.","optimizations_applied":"Precomputed mul tables, SSSE3/AVX2/AVX-512VBMI split-table SIMD, lazy partial symbols, removed redundant init_matrix, ptr::write symbol selection, avoided 512KB copy in decode, fast-path coefficient generation with fill_bytes, separated generic matrix path, added optimized profile with LTO","next_steps":"Would need field isomorphism from AESTowerField8b to standard AES polynomial to use GFNI at runtime, or switch to a field representation compatible with GFNI"}}
{"run":16,"commit":"36b3c6b","metric":0.0173,"metrics":{"decode_time_ms":0.1792,"recode_time_ms":0.0097},"status":"keep","description":"Use unchecked SIMD scale_add_assign in encoder/recode/decode_symbol hot paths; eliminate redundant scalar==0/==1 checks per coefficient","timestamp":1777846793589,"segment":0,"confidence":304.7724867724866,"iterationTokens":11334,"asi":{"decode_improvement":"~1.9% vs 182.7µs baseline","encode_improvement":"~3.3% vs 17.9µs baseline","hypothesis":"scale_add_assign_simd checks scalar==0 and scalar==1 on every call. In the encoder/recode hot loops, the caller already knows scalar != 0 (checked in the loop). Using scale_add_assign_simd_unchecked skips these redundant checks.","recode_improvement":"~6.7% vs 10.4µs baseline"}}
{"run":17,"commit":"3b8e52d","metric":0.0177,"metrics":{"decode_time_ms":0.1796,"recode_time_ms":0.0095},"status":"keep","description":"Use unchecked SIMD in decoder Gauss-Jordan scale/scale_add_assign; cumulative ~1-2% encode, ~1.7% decode, ~8.6% recode vs baseline","timestamp":1777847484921,"segment":0,"confidence":1800.0624999999989,"iterationTokens":4666,"asi":{"hypothesis":"Eliminate redundant scalar==0/==1 checks in decoder Gauss-Jordan by using unchecked SIMD wrappers","note":"Variance is high (encode 17.7±0.3µs, decode 179.6±1µs, recode 9.5±0.4µs). Cumulative improvement from before unchecked SIMD changes: encode ~1.2%, decode ~1.9%, recode ~8.6%.","next_action_hint":"Explore flattening encoder data storage or inlining Symbol wrapper to match rlnc's flat Vec<u8> layout"}}
{"run":18,"commit":"891d58e","metric":0.0172,"metrics":{"decode_time_ms":0.1801,"recode_time_ms":0.0094},"status":"keep","description":"Revert flat Vec<u8> encoder data experiment (worse encode); keep unchecked SIMD in hot paths","timestamp":1777848150011,"segment":0,"confidence":2133.4074074074065,"iterationTokens":5780,"asi":{"hypothesis":"Flat Vec<u8> with chunks_exact(M) in encoder hurt performance (~18.4µs vs ~17.2µs). The Symbol<M> wrapper is already zero-cost due to #[repr(transparent)] and Copy.","flat_data_result":"Worse encode performance; LLVM optimizes Symbol iteration better than chunks_exact","next_action_hint":"Remaining gap is small. Focus on micro-optimizations in decoder coefficient matrix ops or try parallel encode for very large symbol counts."}}
{"run":19,"commit":"dd1bc57","metric":0.0172,"metrics":{"decode_time_ms":0.1755,"recode_time_ms":0.0094},"status":"keep","description":"Eliminate redundant check_rank_increase in decoder add_symbol; incremental_rref_update now correctly returns rank increase bool","timestamp":1777848856862,"segment":0,"confidence":2618.272727272726,"iterationTokens":5760,"asi":{"decode_improvement":"~2.5% vs 180µs baseline","hypothesis":"Decoder add_symbol called check_rank_increase (elimination on scratch_row) before pushing, then incremental_diagonalization called add_row_unchecked which ran incremental_rref_update (elimination on actual matrix row). This doubled the coefficient matrix work. By having incremental_rref_update return bool and removing the explicit check_rank_increase from add_symbol, we eliminate the redundant work.","encode_status":"unchanged (~17.2µs)","recode_status":"unchanged (~9.4µs)"}}
{"run":20,"commit":"d014798","metric":0.0177,"metrics":{"decode_time_ms":0.1756,"recode_time_ms":0.01},"status":"keep","description":"Final state after eliminating redundant check_rank_increase in decoder add_symbol","timestamp":1777851961951,"segment":0,"confidence":3031.684210526317,"iterationTokens":16094,"asi":{"hypothesis":"Decoder add_symbol no longer calls check_rank_increase before pushing; instead incremental_diagonalization pops redundant rows. This eliminates double elimination of coefficient rows.","decode_vs_baseline":"~175.6µs vs original ~20.4ms = ~116× faster","encode_vs_baseline":"~17.7µs vs original ~2.9ms = ~164× faster","recode_vs_baseline":"~10.0µs vs original ~1.17ms = ~117× faster"}}
{"run":21,"commit":"06b7cfe","metric":0.018,"metrics":{"decode_time_ms":0.1781,"recode_time_ms":0.0094},"status":"keep","description":"Cache is_aes flag in RlnDecoder to avoid repeated TypeId checks in recode/decode/decode_symbol/gaussian_elimination","timestamp":1777852587761,"segment":0,"confidence":3600.125000000006,"iterationTokens":16094,"asi":{"hypothesis":"Repeated TypeId::of::<F>() checks in hot paths (recode, decode_symbol, gaussian_elimination) add small overhead. Caching a boolean flag during configure() eliminates this.","recode_improvement":"9.4µs vs previous ~10.0µs = ~6% faster","decode_status":"unchanged (~176-178µs)","encode_status":"unchanged (~17.7-18.0µs)"}}
{"run":22,"commit":"d16d496","metric":0.0172,"metrics":{"decode_time_ms":0.1753,"recode_time_ms":0.0095},"status":"keep","description":"Cache is_aes flag in RlnEncoder to avoid repeated TypeId checks in encode_symbol","timestamp":1777853014189,"segment":0,"confidence":3600.125000000006,"iterationTokens":12295,"asi":{"hypothesis":"Repeated TypeId::of::<F>() checks in encode_symbol add small overhead. Caching a boolean flag during configure() eliminates this.","encode_improvement":"17.2µs matches prior best, removes TypeId overhead","decode_status":"unchanged (~175µs)","recode_status":"unchanged (~9.5µs)"}}
{"run":23,"commit":"f98d913","metric":0.018,"metrics":{"decode_time_ms":0.1772,"recode_time_ms":0.0091},"status":"keep","description":"Replace transmute_copy with direct pointer dereference for AES coefficient byte extraction in encoder","timestamp":1777853534899,"segment":0,"confidence":3600.125000000006,"iterationTokens":2395,"asi":{"hypothesis":"transmute_copy has slight call overhead compared to raw pointer dereference for extracting u8 from AESTowerField8b. Replacing with *(ptr as *const u8) is simpler and marginally faster.","recode_improvement":"9.1µs new best vs previous ~9.5µs","encode_status":"unchanged (~18µs)","decode_status":"unchanged (~177µs)"}}
{"run":24,"commit":"171a8b4","metric":0.0177,"metrics":{"decode_time_ms":0.1719,"recode_time_ms":0.0096},"status":"keep","description":"Hoist get_tables() call out of inner SIMD functions into public wrappers; pass tables as parameter to avoid redundant OnceLock fast-path overhead","timestamp":1777855001077,"segment":0,"confidence":3600.125000000006,"iterationTokens":20723,"asi":{"decode_improvement":"171.9µs new best vs previous ~176µs = ~2.3% faster","encode_status":"unchanged (~17.7µs)","hypothesis":"Inner SIMD functions called get_tables() which hits a OnceLock fast path. Hoisting the call to the public wrapper and passing &SimdMulTables removes this per-call overhead and may improve inlining.","recode_status":"unchanged (~9.6µs)"}}
{"run":25,"commit":"f4e708f","metric":0.0178,"metrics":{"decode_time_ms":0.1699,"recode_time_ms":0.008},"status":"keep","description":"Branchless AES hot paths: remove s!=0 and s==1 branches in encoder, recode, and decode_symbol; always call scale_add_assign_simd_unchecked to eliminate branch mispredictions","timestamp":1777859766327,"segment":0,"confidence":3600.125000000006,"iterationTokens":135796,"asi":{"decode_improvement":"169.9µs vs previous ~171.9µs = ~1.2% faster","encode_status":"unchanged (~17.8µs)","hypothesis":"Branch mispredictions on s!=0 and s==1 in hot loops waste CPU cycles. For random coefficients, ~12.5% are 0 or 1, causing frequent mispredictions. Removing branches makes loop more uniform and compiler-friendly.","recode_improvement":"8.0µs vs previous ~9.6µs = ~17% faster"}}
{"run":26,"commit":"cc465d3","metric":0.0164,"metrics":{"decode_time_ms":0.1705,"recode_time_ms":0.0086},"status":"keep","description":"Cache result.data_mut() in encoder hot loop; rewrite GFNI 512-bit functions with chunks_exact + manual unrolling like rlnc","timestamp":1777860886777,"segment":0,"confidence":3840.7999999999965,"iterationTokens":19145,"asi":{"encode_improvement":"16.4µs vs previous ~17.8µs = ~8% faster","decode_status":"unchanged (~170.5µs)","hypothesis":"Calling result.data_mut() inside the hot loop might prevent the compiler from hoisting the mutable borrow. Caching it outside the loop removes this overhead. Also, manual unrolling with chunks_exact might improve ILP.","recode_status":"slightly worse (~8.6µs vs ~8.0µs)"}}
{"run":27,"commit":"4771e2e","metric":0.0161,"metrics":{"decode_time_ms":0.1703,"recode_time_ms":0.009},"status":"keep","description":"Branchless encoder + cached data_mut + GFNI manual unrolling: encode new best 16.1µs","timestamp":1777861586860,"segment":0,"confidence":4115.571428571433,"iterationTokens":1313,"asi":{"encode_improvement":"16.1µs new best vs previous ~17.8µs = ~9.6% faster","decode_status":"unchanged (~170.3µs)","recode_status":"~9.0µs vs previous ~8.0µs baseline (branchless hurt recode slightly)","hypothesis":"Caching result.data_mut() outside the loop + branchless SIMD calls + manual unrolling in GFNI 512-bit path yields better encode performance. Reverted data_mut caching in recode/decode_symbol since it didn't help."}}
{"run":28,"commit":"56f40aa","metric":0.0169,"metrics":{"decode_time_ms":0.1709,"recode_time_ms":0.0086},"status":"keep","description":"Remove coeffs_u8 transmute in encoder; iterate directly over coefficients with transmute_copy per element","timestamp":1777863246071,"segment":0,"confidence":4432.153846153861,"iterationTokens":2786,"asi":{"encode_status":"~16.9µs vs ~17.1µs baseline = slight improvement","hypothesis":"The &amp;[F] to &amp;[AESTowerField8b] transmute created an extra slice reference that might have prevented some optimizations. Iterating directly over coefficients avoids this.","recode_status":"~8.6µs","decode_status":"~170.9µs"}}
